{
  "schema_version": "1.0",
  "scenario_id": "s01_cellar",
  "seed": 12345,
  "turn_number": 18,
  "round_number": 4,
  "active_combatant_id": "pc_lyra",
  "initiative_order": [
    "npc_smuggler_01",
    "npc_rat_01",
    "pc_lyra",
    "npc_rat_02",
    "npc_smuggler_02",
    "npc_rat_03",
    "npc_rat_04"
  ],
  "encounter_active": true,
  "encounter_outcome": null,

  "combatants": {
    "pc_lyra": {
      "combatant_id": "pc_lyra",
      "display_name": "Lyra",
      "is_player_character": true,
      "faction": "party",
      "abilities": {"str": 12, "dex": 16, "con": 14, "int": 10, "wis": 13, "cha": 11},
      "proficient_skills": ["perception", "stealth"],
      "armour_class": 14,
      "max_hp": 20,
      "current_hp": 9,
      "status": "active",
      "dodging": false,
      "spell_attack_bonus": 5,
      "spellcasting_modifier": 3,
      "spell_slots_1": 1
    },
    "npc_rat_01": {
      "combatant_id": "npc_rat_01",
      "display_name": "giant rat",
      "is_player_character": false,
      "faction": "hostile",
      "abilities": {"str": 7, "dex": 15, "con": 11, "int": 2, "wis": 10, "cha": 4},
      "proficient_skills": ["perception"],
      "armour_class": 12,
      "max_hp": 11,
      "current_hp": 4,
      "status": "active",
      "dodging": false,
      "spell_attack_bonus": null,
      "spellcasting_modifier": null,
      "spell_slots_1": null
    },
    "npc_rat_02": {
      "combatant_id": "npc_rat_02",
      "display_name": "giant rat",
      "is_player_character": false,
      "faction": "hostile",
      "abilities": {"str": 7, "dex": 15, "con": 11, "int": 2, "wis": 10, "cha": 4},
      "proficient_skills": ["perception"],
      "armour_class": 12,
      "max_hp": 11,
      "current_hp": 11,
      "status": "active",
      "dodging": true,
      "spell_attack_bonus": null,
      "spellcasting_modifier": null,
      "spell_slots_1": null
    },
    "npc_rat_03": {
      "combatant_id": "npc_rat_03",
      "display_name": "giant rat",
      "is_player_character": false,
      "faction": "hostile",
      "abilities": {"str": 7, "dex": 15, "con": 11, "int": 2, "wis": 10, "cha": 4},
      "proficient_skills": ["perception"],
      "armour_class": 12,
      "max_hp": 11,
      "current_hp": 0,
      "status": "unconscious",
      "dodging": false,
      "spell_attack_bonus": null,
      "spellcasting_modifier": null,
      "spell_slots_1": null
    },
    "npc_rat_04": {
      "combatant_id": "npc_rat_04",
      "display_name": "giant rat",
      "is_player_character": false,
      "faction": "hostile",
      "abilities": {"str": 7, "dex": 15, "con": 11, "int": 2, "wis": 10, "cha": 4},
      "proficient_skills": ["perception"],
      "armour_class": 12,
      "max_hp": 11,
      "current_hp": 8,
      "status": "active",
      "dodging": false,
      "spell_attack_bonus": null,
      "spellcasting_modifier": null,
      "spell_slots_1": null
    },
    "npc_smuggler_01": {
      "combatant_id": "npc_smuggler_01",
      "display_name": "smuggler with a scarred lip",
      "is_player_character": false,
      "faction": "hostile",
      "abilities": {"str": 13, "dex": 14, "con": 12, "int": 10, "wis": 11, "cha": 12},
      "proficient_skills": ["stealth", "strength"],
      "armour_class": 13,
      "max_hp": 16,
      "current_hp": 10,
      "status": "active",
      "dodging": false,
      "spell_attack_bonus": null,
      "spellcasting_modifier": null,
      "spell_slots_1": null
    },
    "npc_smuggler_02": {
      "combatant_id": "npc_smuggler_02",
      "display_name": "hooded smuggler",
      "is_player_character": false,
      "faction": "hostile",
      "abilities": {"str": 10, "dex": 15, "con": 12, "int": 12, "wis": 13, "cha": 10},
      "proficient_skills": ["perception", "stealth"],
      "armour_class": 13,
      "max_hp": 14,
      "current_hp": 14,
      "status": "active",
      "dodging": false,
      "spell_attack_bonus": 4,
      "spellcasting_modifier": 1,
      "spell_slots_1": 2
    }
  },

  "inventory": {
    "pc_lyra": {
      "item_short_sword": 1,
      "item_torch": 2,
      "item_rope": 1,
      "item_iron_key": 1,
      "item_waterskin": 1,
      "item_chalk": 3,
      "item_ledger": 0
    },
    "npc_rat_01": {"item_rat_bite": 1},
    "npc_rat_02": {"item_rat_bite": 1},
    "npc_rat_03": {"item_rat_bite": 1},
    "npc_rat_04": {"item_rat_bite": 1},
    "npc_smuggler_01": {"item_club": 1, "item_crowbar": 1},
    "npc_smuggler_02": {"item_dagger": 2, "item_light_crossbow": 1}
  },

  "item_definitions": {
    "item_short_sword": {
      "item_id": "item_short_sword",
      "display_name": "short sword",
      "is_weapon": true,
      "attack_bonus": 5,
      "damage_dice": "1d6",
      "damage_bonus": 3
    },
    "item_torch": {
      "item_id": "item_torch",
      "display_name": "torch",
      "is_weapon": false
    },
    "item_rat_bite": {
      "item_id": "item_rat_bite",
      "display_name": "bite",
      "is_weapon": true,
      "attack_bonus": 4,
      "damage_dice": "1d4",
      "damage_bonus": 2
    },
    "item_club": {
      "item_id": "item_club",
      "display_name": "studded club",
      "is_weapon": true,
      "attack_bonus": 3,
      "damage_dice": "1d6",
      "damage_bonus": 1
    },
    "item_dagger": {
      "item_id": "item_dagger",
      "display_name": "dagger",
      "is_weapon": true,
      "attack_bonus": 4,
      "damage_dice": "1d4",
      "damage_bonus": 2
    },
    "item_light_crossbow": {
      "item_id": "item_light_crossbow",
      "display_name": "light crossbow",
      "is_weapon": true,
      "attack_bonus": 4,
      "damage_dice": "1d8",
      "damage_bonus": 2
    },
    "item_crowbar": {
      "item_id": "item_crowbar",
      "display_name": "crowbar",
      "is_weapon": false
    },
    "item_rope": {
      "item_id": "item_rope",
      "display_name": "coil of hempen rope",
      "is_weapon": false
    },
    "item_iron_key": {
      "item_id": "item_iron_key",
      "display_name": "rusted iron key",
      "is_weapon": false
    },
    "item_ledger": {
      "item_id": "item_ledger",
      "display_name": "the Keeper's ledger",
      "is_weapon": false
    },
    "item_waterskin": {
      "item_id": "item_waterskin",
      "display_name": "waterskin",
      "is_weapon": false
    },
    "item_chalk": {
      "item_id": "item_chalk",
      "display_name": "stick of chalk",
      "is_weapon": false
    }
  },

  "npc_relationships": {
    "npc_keeper": {
      "npc_id": "npc_keeper",
      "display_name": "the Keeper",
      "stance": "friendly",
      "history": [
        {"turn": 4, "from": "unfriendly", "to": "neutral",
         "justification": "Lyra returned the stolen ledger."},
        {"turn": 9, "from": "neutral", "to": "friendly",
         "justification": "Lyra cleared the rats from the lower cellar without being asked."}
      ]
    },
    "npc_ferryman": {
      "npc_id": "npc_ferryman",
      "display_name": "old Maren the ferryman",
      "stance": "unfriendly",
      "history": [
        {"turn": 6, "from": "neutral", "to": "unfriendly",
         "justification": "Lyra refused to pay the toll and threatened to cut the ferry rope."}
      ]
    },
    "npc_brewer": {
      "npc_id": "npc_brewer",
      "display_name": "Hollis the brewer",
      "stance": "allied",
      "history": [
        {"turn": 2, "from": "neutral", "to": "friendly",
         "justification": "Lyra helped Hollis drag the flooded barrels up the stairs."},
        {"turn": 12, "from": "friendly", "to": "allied",
         "justification": "Lyra kept the smugglers away from the brewhouse door at real risk of injury."}
      ]
    }
  },

  "quests": {
    "quest_missing_ledger": {
      "quest_id": "quest_missing_ledger",
      "display_name": "The Missing Ledger",
      "state": "active",
      "stage": 2,
      "max_stage": 3
    },
    "quest_flooded_cellar": {
      "quest_id": "quest_flooded_cellar",
      "display_name": "Drain the Flooded Cellar",
      "state": "active",
      "stage": 1,
      "max_stage": 2
    },
    "quest_smugglers_cache": {
      "quest_id": "quest_smugglers_cache",
      "display_name": "The Smugglers' Cache",
      "state": "not_started",
      "stage": 0,
      "max_stage": 3
    },
    "quest_keepers_debt": {
      "quest_id": "quest_keepers_debt",
      "display_name": "The Keeper's Debt",
      "state": "completed",
      "stage": 2,
      "max_stage": 2
    }
  }
}
